<?xml version="1.0" encoding="UTF-8" standalone="yes"?>
<serverModel xmlns:xsi="http://www.w3.org/2001/XMLSchema-instance" xsi:noNamespaceSchemaLocation="../serverModel.xsd">
    <storeModels>
        <storeModel>
            <dataSource>a</dataSource>
            <model>Child</model>
            <class>com.ag.cache.test.model.Child</class>
            <readThrough>true</readThrough>
            <writeThrough>true</writeThrough>
            <copyCount>2</copyCount>
            <serverType>CACHE_MANAGER</serverType>
            <storeType>BYTES</storeType>
        </storeModel>
        <storeModel>
            <dataSource>a</dataSource>
            <model>MainTestModel</model>
            <class>com.ag.cache.test.model.MainTestModel</class>
            <readThrough>true</readThrough>
            <writeThrough>true</writeThrough>
            <copyCount>2</copyCount>
            <serverType>CACHE_MANAGER</serverType>

            <storeType>BYTES</storeType>
        </storeModel>
    </storeModels>
    <listeners>
        <listener>
            <host>localhost</host>
            <port>2122</port>
            <backlog>10</backlog>
            <minThreads>5</minThreads>
            <maxThreads>5</maxThreads>
            <status>1</status>
            <properties />
        </listener>
        <listener>
            <host>localhost</host>
            <port>2132</port>
            <backlog>10</backlog>
            <minThreads>5</minThreads>
            <maxThreads>5</maxThreads>
            <status>1</status>
            <properties />
        </listener>
    </listeners>
    <commandPlugins>
        <commandPlugin>
            <checkDelay>3000</checkDelay>
            <class>com.ag.plugin.IdGenerator</class>
            <poolSize>10</poolSize>
            <timeout>10000</timeout>
        </commandPlugin>
    </commandPlugins>
    <servers>
        <connect>
            <status>Unknown</status>
            <threads>8</threads>
            <managementServer>
                <host>localhost</host>
                <port>2242</port>
                <threads>4</threads>
                <timeout>5000</timeout>
            </managementServer>
            <listener>
                <host>localhost</host>
                <port>2232</port>
                <backlog>1000</backlog>
                <minThreads>8</minThreads>
                <maxThreads>8</maxThreads>
                <status>0</status>
                <properties />
            </listener>
        </connect>
        <connect>
            <status>Unknown</status>
            <threads>8</threads>
            <managementServer>
                <host>localhost</host>
                <port>2342</port>
                <threads>4</threads>
                <timeout>5000</timeout>
            </managementServer>
            <listener>
                <host>localhost</host>
                <port>2332</port>
                <backlog>1000</backlog>
                <minThreads>8</minThreads>
                <maxThreads>8</maxThreads>
                <status>0</status>
                <properties />
            </listener>
        </connect>
        <connect>
            <status>Unknown</status>
            <threads>8</threads>
            <managementServer>
                <host>localhost</host>
                <port>2442</port>
                <threads>4</threads>
                <timeout>5000</timeout>
            </managementServer>
            <listener>
                <host>localhost</host>
                <port>2432</port>
                <backlog>1000</backlog>
                <minThreads>8</minThreads>
                <maxThreads>8</maxThreads>
                <status>0</status>
                <properties />
            </listener>
        </connect>
    </servers>
    <clients>
        <connect>
            <status>Unknown</status>
            <threads>8</threads>
            <managementClient>
                <host>localhost</host>
                <port>2042</port>
                <threads>8</threads>
                <timeout>1000</timeout>
            </managementClient>
            <listener>
                <host>localhost</host>
                <port>2132</port>
                <backlog>1000</backlog>
                <minThreads>8</minThreads>
                <maxThreads>8</maxThreads>
                <status>0</status>
                <properties />
            </listener>
        </connect>
    </clients>
    <dataSources>
        <dataSource>
            <name>a</name>
            <class>com.ag.cache.test.userdataaccess.BaseDataInvoker</class>
            <threads>10</threads>
            <timeout>10000</timeout>
            <properties>
                <entry>
                    <key>threads</key>
                    <value>10</value>
                </entry>
                <entry>
                    <key>driver</key>
                    <value>org.hsqldb.jdbcDriver</value>
                </entry>
                <entry>
                    <key>password</key>
                    <value></value>
                </entry>
                <entry>
                    <key>user</key>
                    <value>sa</value>
                </entry>
                <entry>
                    <key>url</key>
                    <value>jdbc:hsqldb:hsql://localhost/test</value>
                </entry>
            </properties>
        </dataSource>
    </dataSources>
    <sessionClients>
        <sessionClient>
            <host>localhost</host>
            <port>5888</port>
            <threads>5</threads>
            <timeout>1000</timeout>
        </sessionClient>
    </sessionClients>
    <calculateStatistic>true</calculateStatistic>
    <saveClients>
        <saveClient>
            <host>localhost</host>
            <port>5824</port>
            <threads>5</threads>
            <timeout>1000</timeout>
        </saveClient>
    </saveClients>
    <saveServers>
        <saveServer>
            <host>localhost</host>
            <port>5824</port>
            <minThreads>25</minThreads>
            <maxThreads>25</maxThreads>
            <keepAliveTime>3000</keepAliveTime>
            <sessionTimeout>1000000</sessionTimeout>
        </saveServer>
    </saveServers>
    <serverName>cacheManager</serverName>
    <sessionServer>
        <host>localhost</host>
        <port>5888</port>
        <minThreads>25</minThreads>
        <maxThreads>25</maxThreads>
        <keepAliveTime>3000</keepAliveTime>
        <sessionTimeLive>18000000</sessionTimeLive>
    </sessionServer>
    <managementServer>
        <host>localhost</host>
        <port>2142</port>
        <minThreads>2</minThreads>
        <maxThreads>12</maxThreads>
        <keepAliveTime>3000</keepAliveTime>
    </managementServer>
</serverModel>
