<?xml version="1.0" encoding="UTF-8" standalone="yes"?>
<serverModel xmlns:xsi="http://www.w3.org/2001/XMLSchema-instance" xsi:noNamespaceSchemaLocation="../serverModel.xsd">
    <storeModels>
        <storeModel>
            <dataSource>a</dataSource>
            <model>Child</model>
            <class>com.ag.cache.test.model.Child</class>
            <readThrough>true</readThrough>
            <writeThrough>true</writeThrough>
            <copyCount>2</copyCount>
            <serverType>CACHE_CACHE_MANAGER</serverType>
            <storeType>BYTES</storeType>
        </storeModel>
        <storeModel>
            <dataSource>a</dataSource>
            <model>NoIdTestModel</model>
            <class>com.ag.cache.test.model.NoIdTestModel</class>
            <readThrough>true</readThrough>
            <writeThrough>true</writeThrough>
            <copyCount>2</copyCount>
            <serverType>CACHE_MANAGER</serverType>

            <storeType>BYTES</storeType>
        </storeModel>
    </storeModels>
    <listeners>
        <listener>
            <host>localhost</host>
            <port>2022</port>
            <backlog>10</backlog>
            <minThreads>5</minThreads>
            <maxThreads>5</maxThreads>
            <status>1</status>
            <properties />
        </listener>
    </listeners>
    <commandPlugins>
        <commandPlugin>
            <checkDelay>3000</checkDelay>
            <class>com.ag.plugin.IdGenerator</class>
            <poolSize>10</poolSize>
            <timeout>10000</timeout>
        </commandPlugin>
    </commandPlugins>
    <servers />
    <clients />
    <sessionClients>
        <sessionClient>
            <host>localhost</host>
            <port>5888</port>
            <threads>5</threads>
            <timeout>1000</timeout>
            <protocolType>UDP</protocolType>
        </sessionClient>
    </sessionClients>
    <calculateStatistic>true</calculateStatistic>
    <saveClients>
        <saveClient>
            <host>localhost</host>
            <port>5824</port>
            <threads>5</threads>
            <timeout>1000</timeout>
            <protocolType>UDP</protocolType>
        </saveClient>
    </saveClients>
    <saveServers>
        <saveServer>
            <host>localhost</host>
            <port>5824</port>
            <minThreads>25</minThreads>
            <maxThreads>25</maxThreads>
            <keepAliveTime>3000</keepAliveTime>
            <protocolType>UDP</protocolType>
            <sessionTimeout>10000</sessionTimeout>
        </saveServer>
    </saveServers>
    <serverName>cacheManager</serverName>
    <sessionServer>
        <host>localhost</host>
        <port>5888</port>
        <minThreads>5</minThreads>
        <maxThreads>25</maxThreads>
        <keepAliveTime>3000</keepAliveTime>
        <protocolType>UDP</protocolType>
        <sessionTimeLive>18000000</sessionTimeLive>
    </sessionServer>
    <managementServer>
        <host>localhost</host>
        <port>2042</port>
        <minThreads>4</minThreads>
        <maxThreads>16</maxThreads>
        <keepAliveTime>3000</keepAliveTime>
    </managementServer>
    <idGeneratorClients>
        <idGeneratorClient>
            <host>localhost</host>
            <port>6888</port>
            <threads>2</threads>
            <timeout>1000</timeout>
            <protocolType>TCP</protocolType>
            <modelNames>
                <modelName>NoIdTestModel</modelName>
                <modelName>Child</modelName>
            </modelNames>
        </idGeneratorClient>
    </idGeneratorClients>
</serverModel>
