<?xml version="1.0" encoding="UTF-8" standalone="yes"?>
<serverModel xmlns:xsi="http://www.w3.org/2001/XMLSchema-instance" xsi:noNamespaceSchemaLocation="../serverModel.xsd">
    <storeModels>
        <storeModel>
            <dataSource>a</dataSource>
            <model>Child</model>
            <class>com.ag.cache.test.model.Child</class>
            <readThrough>true</readThrough>
            <writeThrough>true</writeThrough>
            <copyCount>2</copyCount>
            <serverType>CACHE_MANAGER</serverType>
            <storeType>BYTES</storeType>
        </storeModel>
        <storeModel>
            <dataSource>a</dataSource>
            <model>MainTestModel</model>
            <class>com.ag.cache.test.model.MainTestModel</class>
            <readThrough>true</readThrough>
            <writeThrough>true</writeThrough>
            <copyCount>2</copyCount>
            <serverType>CACHE_MANAGER</serverType>
            <storeType>BYTES</storeType>
        </storeModel>
    </storeModels>
    <listeners>
        <listener>
            <host>localhost</host>
            <port>2122</port>
            <backlog>10</backlog>
            <minThreads>20</minThreads>
            <maxThreads>25</maxThreads>
            <status>1</status>
            <properties />
        </listener>
    </listeners>
    <commandPlugins>
        <commandPlugin>
            <checkDelay>3000</checkDelay>
            <class>com.ag.plugin.IdGenerator</class>
            <poolSize>10</poolSize>
            <timeout>10000</timeout>
        </commandPlugin>
    </commandPlugins>
    <servers />
    <clients />
    <dataSources>

    </dataSources>
    <sessionClients>
        <sessionClient>
            <host>localhost</host>
            <port>5888</port>
            <threads>5</threads>
            <timeout>1000</timeout>
            <protocolType>UDP</protocolType>
        </sessionClient>
    </sessionClients>
    <calculateStatistic>true</calculateStatistic>
    <saveClients>
        <saveClient>
            <host>localhost</host>
            <port>5824</port>
            <threads>2</threads>
            <timeout>1000</timeout>
            <protocolType>UDP</protocolType>
        </saveClient>
    </saveClients>
    <saveServers>
        <saveServer>
            <host>localhost</host>
            <port>5824</port>
            <minThreads>25</minThreads>
            <maxThreads>25</maxThreads>
            <keepAliveTime>3000</keepAliveTime>
            <protocolType>UDP</protocolType>
            <sessionTimeout>10000</sessionTimeout>
        </saveServer>
    </saveServers>
    <serverName>cacheManager</serverName>
    <sessionServer>
        <host>localhost</host>
        <port>5888</port>
        <minThreads>25</minThreads>
        <maxThreads>25</maxThreads>
        <keepAliveTime>3000</keepAliveTime>
        <protocolType>UDP</protocolType>
        <sessionTimeLive>18000000</sessionTimeLive>
        <authorizationService>
            <clazz>com.ag.authorization.FileAuthorizationServiceImpl</clazz>
            <properties>
                <entry>
                    <key>file</key>
                    <value>users.txt</value>
                </entry>
            </properties>
        </authorizationService>
    </sessionServer>
    <managementServer>
        <host>localhost</host>
        <port>2142</port>
        <minThreads>28</minThreads>
        <maxThreads>28</maxThreads>
        <keepAliveTime>3000</keepAliveTime>
    </managementServer>
    <trustSessions>false</trustSessions>
</serverModel>
